{
  "collection_aging_presentment_contract_version": 1,
  "tenant_reference": "urn:cwl:tenant_001",
  "as_of": "2026-08-18T12:00:00Z",
  "currencies": [
    {
      "currency_code": "USD",
      "current": {"case_count": 1, "outstanding_amount": "0.003705"},
      "days_1_30": {"case_count": 1, "outstanding_amount": "1.25"},
      "days_31_60": {"case_count": 0, "outstanding_amount": "0"},
      "days_61_90": {"case_count": 0, "outstanding_amount": "0"},
      "days_90_plus": {"case_count": 1, "outstanding_amount": "8.00"}
    }
  ]
}
